Titulo,URL,Descripcion
The Lovely Bones,/title/tt0380510/,Drama Fantasy Thriller             Centers on a young girl who has been murdered and watches over her family  and her killer  from purgatory She must weigh her desire for vengeance against her desire for her family to heal
Minions: The Rise of Gru,/title/tt5113044/,Animation Adventure Comedy             The untold story of one twelveyearolds dream to become the worlds greatest supervillain
Rio,/title/tt1436562/,Animation Adventure Comedy             When Blu a domesticated macaw from smalltown Minnesota meets the fiercely independent Jewel he takes off on an adventure to Rio de Janeiro with the bird of his dreams
Adaptation.,/title/tt0268126/,Comedy Drama             A lovelorn screenwriter becomes desperate as he tries and fails to adapt The Orchid Thief by Susan Orlean for the screen
The Royal Tenenbaums,/title/tt0265666/,Comedy Drama             The eccentric members of a dysfunctional family reluctantly gather under the same roof for various reasons
Gummo,/title/tt0119237/,Comedy Drama             Lonely residents of a tornadostricken Ohio town wander the deserted landscape trying to fulfill their boring nihilistic lives
The Guilty,/title/tt9421570/,Crime Drama Thriller             A demoted police officer assigned to a call dispatch desk is conflicted when he receives an emergency phone call from a kidnapped woman
Sausage Party,/title/tt1700841/,Animation Adventure Comedy             A sausage strives to discover the truth about his existence
A Few Good Men,/title/tt0104257/,Drama Thriller             Military lawyer Lieutenant Daniel Kaffee defends Marines accused of murder They contend they were acting under orders
Empire of Light,/title/tt14402146/,Drama Romance             A drama about the power of human connection during turbulent times set in an English coastal town in the early 1980s
Contact,/title/tt0118884/,Drama Mystery SciFi             Dr Ellie Arroway after years of searching finds conclusive radio proof of extraterrestrial intelligence sending plans for a mysterious machine
The Princess Diaries,/title/tt0247638/,Comedy Family Romance             Mia Thermopolis has just found out that she is the heir apparent to the throne of Genovia With her friends Lilly and Michael Moscovitz in tow she tries to navigate through the rest of her sixteenth year
Trading Places,/title/tt0086465/,Comedy             A snobbish investor and a wily street con artist find their positions reversed as part of a bet by two callous millionaires
Bring It On,/title/tt0204946/,Comedy Romance Sport             A champion high school cheerleading squad discovers its previous captain stole all their best routines from an innercity school and must scramble to compete at this years championships
The Dictator,/title/tt1645170/,Comedy             The heroic story of a dictator who risked his life to ensure that democracy would never come to the country he so lovingly oppressed
Freaky,/title/tt10919380/,Comedy Horror Thriller             After swapping bodies with a deranged serial killer a highschool senior discovers that she has fewer than 24 hours before the change becomes permanent
A Bronx Tale,/title/tt0106489/,Crime Drama             A father becomes worried when a local gangster befriends his son in the Bronx in the 1960s
Legend,/title/tt0089469/,Adventure Fantasy Romance             A young man must stop the Lord of Darkness from destroying daylight and marrying the woman he loves
The Good Nurse,/title/tt4273800/,Biography Crime Drama             An infamous caregiver is implicated in the deaths of hundreds of hospital patients
Poker Face,/title/tt14714980/,Action Crime Thriller             A tech billionaire hosts a highstakes poker game between friends but the evening takes a turn when longheld secrets are revealed an elaborate revenge plot unfolds and thieves break in
A Tourist's Guide to Love,/title/tt20115096/,Adventure Comedy Romance             An executive goes through an unexpected breakup then accepting an assignment to go undercover and learn about the tourist industry in Vietnam
Rush Hour,/title/tt0120812/,Action Comedy Crime             A loyal and dedicated Hong Kong Inspector teams up with a reckless and loudmouthed LAPD detective to rescue the Chinese Consuls kidnapped daughter while trying to arrest a dangerous crime lord along the way
The Rock,/title/tt0117500/,Action Adventure Thriller             A mildmannered chemist and an excon must lead the counterstrike when a rogue group of military men led by a renegade general threaten a nerve gas attack from Alcatraz against San Francisco
Predestination,/title/tt2397535/,Action Drama SciFi             For his final assignment a top temporal agent must pursue the one criminal that has eluded him throughout time The chase turns into a unique surprising and mindbending exploration of love fate identity and time travel taboos
The Warriors,/title/tt0080120/,Action Crime Thriller             A street gang known as The Warriors must fight their way from the Bronx to their home turf on Coney Island when they are falsely accused of assassinating a respected gang leader
Liar Liar,/title/tt0119528/,Comedy Fantasy             A pathological liarlawyer finds his career turned upside down when he inexplicably cannot physically lie for 24 whole hours
Skyfall,/title/tt1074638/,Action Adventure Thriller             James Bonds loyalty to M is tested when her past comes back to haunt her When MI6 comes under attack 007 must track down and destroy the threat no matter how personal the cost
Where the Heart Is,/title/tt0198021/,Comedy Drama Romance             A pregnant seventeenyearold rebuilds her life after being abandoned by her boyfriend at a Walmart in Sequoyah Oklahoma
Mystic River,/title/tt0327056/,Crime Drama Mystery             The lives of three men who were childhood friends are shattered when one of them has a family tragedy
13 Going on 30,/title/tt0337563/,Comedy Fantasy Romance             Jenna Rink makes an unusual wish on her birthday Miraculously her wish comes true and the 13yearold Jenna wakes up the next day as a 30yearold woman
Blazing Saddles,/title/tt0071230/,Comedy Western             In order to ruin a western town a corrupt politician appoints a black Sheriff who promptly becomes his most formidable adversary
Fear and Loathing in Las Vegas,/title/tt0120669/,Adventure Comedy Drama             An oddball journalist and his psychopathic lawyer travel to Las Vegas for a series of psychedelic escapades
The Place Beyond the Pines,/title/tt1817273/,Crime Drama Thriller             A motorcycle stuntrider turns to robbing banks as a way to provide for his lover and their newborna decision that sets him on a collision course with an ambitious rookie cop navigating a department ruled by a corrupt detective
Mufasa: The Lion King,/title/tt13186482/,Animation Adventure Drama             Simba having become king of the Pride Lands is determined for his cub to follow in his paw prints while the origins of his late father Mufasa are explored
Orphan: First Kill,/title/tt11851548/,Crime Drama Horror             After orchestrating a brilliant escape from an Estonian psychiatric facility Esther travels to America by impersonating the missing daughter of a wealthy family
Doctor Strange,/title/tt1211837/,Action Adventure Fantasy             While on a journey of physical and spiritual healing a brilliant neurosurgeon is drawn into the world of the mystic arts
Dances with Wolves,/title/tt0099348/,Adventure Drama Western             Lieutenant John Dunbar assigned to a remote western Civil War outpost finds himself engaging with a neighbouring Sioux settlement causing him to question his own purpose
The Karate Kid,/title/tt0087538/,Action Drama Family             A martial arts master agrees to teach karate to a bullied teenager
The Starling Girl,/title/tt21156390/,Drama             17yearold Jem Starling struggles with her place within her Christian fundamentalist community But everything changes when her magnetic youth pastor Owen returns to their church
The Girl with the Dragon Tattoo,/title/tt1568346/,Crime Drama Mystery             Journalist Mikael Blomkvist is aided in his search for a woman who has been missing for 40 years by young computer hacker Lisbeth Salander
Coma,/title/tt0077355/,Drama Mystery Thriller             When a young female doctor notices an unnatural amount of comas occurring in her hospital she uncovers a horrible conspiracy
TRON: Legacy,/title/tt1104001/,Action Adventure SciFi             The son of a virtual world designer goes looking for his father and ends up inside the digital world that his father designed He meets his fathers corrupted creation and a unique ally who was born inside the digital world
A Bug's Life,/title/tt0120623/,Animation Adventure Comedy             A misfit ant looking for warriors to save his colony from greedy grasshoppers recruits a group of bugs that turn out to be an inept circus troupe
Conan the Destroyer,/title/tt0087078/,Action Adventure Fantasy             Conan leads a ragtag group of adventurers on a quest for a princess
El Camino: A Breaking Bad Movie,/title/tt9243946/,Action Crime Drama             Fugitive Jesse Pinkman runs from his captors the law and his past
Silver Linings Playbook,/title/tt1045658/,Comedy Drama Romance             After a stint in a mental institution former teacher Pat Solitano moves back in with his parents and tries to reconcile with his exwife Things get more challenging when Pat meets Tiffany a mysterious girl with problems of her own
Shooter,/title/tt0822854/,Action Drama Thriller             A marksman living in exile is coaxed back into action after hearing of a plot to kill the President After beingdouble crossed for the attempt and on the run he sets out for the real killer and the truth
The Lego Movie,/title/tt1490017/,Animation Action Adventure             An ordinary LEGO construction worker thought to be the prophesied as special is recruited to join a quest to stop an evil tyrant from gluing the LEGO universe into eternal stasis
Waiting...,/title/tt0348333/,Comedy             Young employees at ShenaniganZ restaurant collectively stave off boredom and adulthood with their antics
Spaceballs,/title/tt0094012/,Adventure Comedy SciFi             A starpilot for hire and his trusty sidekick must come to the rescue of a princess and save Planet Druidia from the clutches of the evil Spaceballs
The Covenant,/title/tt0475944/,Action Adventure Fantasy             Four young men who belong to a New England supernatural legacy are forced to battle a fifth power long thought to have died out Meanwhile jealousy and suspicion threaten to tear them apart
8 Mile,/title/tt0298203/,Drama Music             Follows a young rapper in the Detroit area struggling with every aspect of his life wants to make it big but his friends and foes make this odyssey of rap harder than it may seem
2 Hearts,/title/tt5616176/,Drama Romance             For two couples the future unfolds in different decades and different places but a hidden connection will bring them together in a way no one could have predicted
The Lost Boys,/title/tt0093437/,Comedy Horror             After moving to a new town two brothers discover that the area is a haven for vampires
No Strings Attached,/title/tt1411238/,Comedy Romance             A guy and girl try to keep their relationship strictly physical but its not long before they learn that they want something more
Juno,/title/tt0467406/,Comedy Drama             Faced with an unplanned pregnancy an offbeat young woman makes a selfless decision regarding the unborn child
Army of Darkness,/title/tt0106308/,Comedy Horror             A sardonic hardware store clerk is accidentally transported to 1300 AD where he must retrieve the Necronomicon and battle an army of the dead so he can return home
Austin Powers: The Spy Who Shagged Me,/title/tt0145660/,Action Adventure Comedy             Dr Evil is back and has invented a new time machine that allows him to go back to the 1960s and steal Austin Powers mojo inadvertently leaving him shagless
Moonlight,/title/tt4975722/,Drama             A young AfricanAmerican man grapples with his identity and sexuality while experiencing the everyday struggles of childhood adolescence and burgeoning adulthood
St. Elmo's Fire,/title/tt0090060/,Drama Romance             A group of friends just out of college struggle with adulthood
Batman & Robin,/title/tt0118688/,Action SciFi             Batman and Robin try to keep their relationship together even as they must stop Mr Freeze and Poison Ivy from freezing Gotham City
The Italian Job,/title/tt0317740/,Action Crime Thriller             After being betrayed and left for dead in Italy Charlie Croker and his team plan an elaborate gold heist against their former ally
Carrie,/title/tt0074285/,Horror Mystery             Carrie White a shy friendless teenage girl who is sheltered by her domineering religious mother unleashes her telekinetic powers after being humiliated by her classmates at her senior prom
Before Sunrise,/title/tt0112471/,Drama Romance             A young man and woman meet on a train in Europe and wind up spending one evening together in Vienna Unfortunately both know that this will probably be their only night together
Creed,/title/tt3076658/,Action Drama Sport             The former World Heavyweight Champion Rocky Balboa serves as a trainer and mentor to Adonis Johnson the son of his late friend and former rival Apollo Creed
The Young Victoria,/title/tt0962736/,Biography Drama History             A dramatization of the turbulent first years of Queen Victorias rule and her enduring romance with Prince Albert
Smokey and the Bandit,/title/tt0076729/,Action Adventure Comedy             The Bandit is hired on to run a tractortrailer full of beer over state lines in hot pursuit by a pesky sheriff
Incredibles 2,/title/tt3606756/,Animation Action Adventure             The Incredibles family takes on a new mission which involves a change in family roles Bob Parr Mr Incredible must manage the house while his wife Helen Elastigirl goes out to save the world
21 Jump Street,/title/tt1232829/,Action Comedy Crime             A pair of underachieving cops are sent back to a local high school to blend in and bring down a synthetic drug ring
The Remains of the Day,/title/tt0107943/,Drama Romance             A butler who sacrificed body and soul to service in the years leading up to World War II realizes too late how misguided his loyalty was to his lordly employer
Moulin Rouge!,/title/tt0203009/,Drama Musical Romance             A poor Bohemian poet in 1890s Paris falls for a beautiful courtesan and nightclub star coveted by a jealous duke
Beauty and the Beast,/title/tt0101414/,Animation Family Fantasy             A prince cursed to spend his days as a hideous monster sets out to regain his humanity by earning a young womans love
Olympus Has Fallen,/title/tt2302755/,Action Thriller             Secret Service agent Mike Banning finds himself trapped inside the White House in the wake of a terrorist attack and works with national security to rescue the President from his kidnappers
Legally Blonde,/title/tt0250494/,Comedy Romance             Elle Woods a fashionable sorority queen is dumped by her boyfriend She decides to follow him to law school While she is there she figures out that there is more to her than just looks
Willy Wonka & the Chocolate Factory,/title/tt0067992/,Family Fantasy Musical             A poor but hopeful boy seeks one of the five coveted golden tickets that will send him on a tour of Willy Wonkas mysterious chocolate factory
Batman Returns,/title/tt0103776/,Action Crime Fantasy             While Batman deals with a deformed man calling himself the Penguin wreaking havoc across Gotham with the help of a cruel businessman a female employee of the latter becomes the Catwoman with her own vendetta
V for Vendetta,/title/tt0434409/,Action Drama SciFi             In a future British dystopian society a shadowy freedom fighter known only by the alias of V plots to overthrow the tyrannical government  with the help of a young woman
Beast,/title/tt13223398/,Action Adventure Drama             A father and his two teenage daughters find themselves hunted by a massive rogue lion intent on proving that the Savanna has but one apex predator
A Simple Favor,/title/tt7040874/,Comedy Crime Mystery             Stephanie is a single mother with a parenting vlog who befriends Emily a secretive upperclass woman who has a child at the same elementary school When Emily goes missing Stephanie takes it upon herself to investigate
Master and Commander: The Far Side of the World,/title/tt0311113/,Action Adventure Drama             During the Napoleonic Wars a brash British captain pushes his ship and crew to their limits in pursuit of a formidable French war vessel around South America
Glass,/title/tt6823368/,Drama Horror SciFi             Security guard David Dunn uses his supernatural abilities to track Kevin Wendell Crumb a disturbed man who has twentyfour personalities
Rain Man,/title/tt0095953/,Drama             After a selfish LA yuppie learns his estranged father left a fortune to an autisticsavant brother in Ohio that he didnt know existed he absconds with his brother and sets out across the country hoping to gain a larger inheritance
The Shape of Water,/title/tt5580390/,Drama Fantasy Romance             At a top secret research facility in the 1960s a lonely janitor forms a unique relationship with an amphibious creature that is being held in captivity
Kick-Ass,/title/tt1250777/,Action Comedy Crime             Dave Lizewski is an unnoticed high school student and comic book fan who one day decides to become a superhero even though he has no powers training or meaningful reason to do so
Hackers,/title/tt0113243/,Crime Drama Romance             Hackers are blamed for making a virus that will capsize five oil tankers
Passengers,/title/tt1355644/,Drama Romance SciFi             A malfunction in a sleeping pod on a spacecraft traveling to a distant colony planet wakes one passenger 90 years early
The Favourite,/title/tt5083738/,Biography Comedy Drama             In early 18thcentury England the status quo at the court is upset when a new servant arrives and endears herself to a frail Queen Anne
Red Dragon,/title/tt0289765/,Crime Drama Thriller             A retired FBI agent with psychological gifts is assigned to help track down The Tooth Fairy a mysterious serial killer Aiding him is imprisoned forensic psychiatrist Dr Hannibal The Cannibal Lecter
Watcher,/title/tt12004038/,Drama Horror Thriller             A young American woman moves with her husband to Bucharest and begins to suspect that a stranger who watches her from the apartment building across the street may be a local serial killer decapitating women
Signs,/title/tt0286106/,Drama Mystery SciFi             A widowed former reverend living with his children and brother on a Pennsylvania farm finds mysterious crop circles in their fields which suggests something more frightening to come
Cast Away,/title/tt0162222/,Adventure Drama Romance             A FedEx executive undergoes a physical and emotional transformation after crash landing on a deserted island
Doc Savage: The Man of Bronze,/title/tt0072886/,Action Adventure Comedy             Doc and the Amazing Five battle Captain Seas and the green death for control of a fabulous resource
Natural Born Killers,/title/tt0110632/,Action Crime Drama             Two victims of traumatized childhoods become lovers and psychopathic serial murderers irresponsibly glorified by the mass media
GoldenEye,/title/tt0113189/,Action Adventure Thriller             Years after a friend and fellow 00 agent is killed on a joint mission a Russian crime syndicate steals a secret spacebased weapons program known as GoldenEye and James Bond has to stop them from using it
What Happened to Monday,/title/tt1536537/,Action Crime Fantasy             In a world where families are limited to one child due to overpopulation a set of identical septuplets must avoid being put to a long sleep by the government and dangerous infighting while investigating the disappearance of one of their own
Hannibal,/title/tt0212985/,Crime Drama Thriller             Living in exile Dr Hannibal Lecter tries to reconnect with now disgraced FBI Agent Clarice Starling and finds himself a target for revenge from a powerful victim
Argo,/title/tt1024648/,Biography Drama Thriller             Acting under the cover of a Hollywood producer scouting a location for a science fiction film a CIA agent launches a dangerous operation to rescue six Americans in Tehran during the US hostage crisis in Iran in 1979
Warcraft,/title/tt0803096/,Action Adventure Fantasy             As an Orc horde invades the planet Azeroth using a magic portal a few human heroes and dissenting Orcs must attempt to stop the true evil behind this war
Coach Carter,/title/tt0393162/,Biography Drama Sport             Controversy surrounds high school basketball coach Ken Carter after he benches his entire team for breaking their academic contract with him
Deep Blue Sea,/title/tt0149261/,Action Adventure SciFi             Searching for a cure to Alzheimers disease a group of scientists on an isolated research facility become the prey as a trio of intelligent sharks fight back
Raging Bull,/title/tt0081398/,Biography Drama Sport             The life of boxer Jake LaMotta whose violence and temper that led him to the top in the ring destroyed his life outside of it
Jeepers Creepers,/title/tt0263488/,Horror Mystery             A brother and sister driving home through isolated countryside for spring break encounter a flesheating creature which is in the midst of its ritualistic eating spree
I'm Thinking of Ending Things,/title/tt7939766/,Drama Thriller             Full of misgivings a young woman travels with her new boyfriend to his parents secluded farm Upon arriving she comes to question everything she thought she knew about him and herself
"Good Luck to You, Leo Grande",/title/tt13352968/,Comedy Drama             Nancy Stokes a retired school teacher is yearning for some adventure and some sex And she has a plan which involves hiring a young sex worker named Leo Grande
Pirates of the Caribbean: Dead Man's Chest,/title/tt0383574/,Action Adventure Fantasy             Jack Sparrow races to recover the heart of Davy Jones to avoid enslaving his soul to Jones service as other friends and foes seek the heart for their own agenda as well
After Ever Happy,/title/tt13070038/,Drama Romance             As a shocking truth about a couples families emerges the two lovers discover they are not so different from each other Tessa is no longer the sweet simple good girl she was when she met Hardin  any more than he is the cruel moody boy she fell so hard for
Hardcore,/title/tt0079271/,Crime Drama             A conservative Midwest businessman ventures into the underworld of pornography in California to look for his runaway teenage daughter who is making porno films in Californias porno pits
Captain America: The Winter Soldier,/title/tt1843866/,Action Adventure SciFi             As Steve Rogers struggles to embrace his role in the modern world he teams up with a fellow Avenger and SHIELD agent Black Widow to battle a new threat from history an assassin known as the Winter Soldier
Gran Torino,/title/tt1205489/,Drama             After a Hmong teenager tries to steal his prized 1972 Gran Torino a disgruntled prejudiced Korean War veteran seeks to redeem both the boy and himself
Bros,/title/tt9731598/,Comedy Romance             Two men with commitment problems attempt a relationship
Platoon,/title/tt0091763/,Drama War             Chris Taylor a neophyte recruit in Vietnam finds himself caught in a battle of wills between two sergeants one good and the other evil A shrewd examination of the brutality of war and the duality of man in conflict
Bird Box,/title/tt2737304/,Horror Mystery SciFi             Five years after an ominous unseen presence drives most of society to suicide a mother and her two children make a desperate bid to reach safety
Terminator Genisys,/title/tt1340138/,Action Adventure SciFi             When John Connor leader of the human resistance sends Sgt Kyle Reese back to 1984 to protect Sarah Connor and safeguard the future an unexpected turn of events creates a fractured timeline
Highlander,/title/tt0091203/,Action Adventure Fantasy             An immortal Scottish swordsman must confront the last of his immortal opponent a murderously brutal barbarian who lusts for the fabled Prize
Transformers: Dark of the Moon,/title/tt1399103/,Action Adventure SciFi             The Autobots learn of a Cybertronian spacecraft hidden on the moon and race against the Decepticons to reach it and to learn its secrets
Wild Things,/title/tt0120890/,Crime Drama Mystery             A police detective uncovers a conspiracy behind a case involving a highschool guidance counselor when accusations of rape are made against him by two female students
Hud,/title/tt0057163/,Drama Western             Honest and hardworking Texas rancher Homer Bannon has a conflict with his unscrupulous selfish arrogant and egotistical son Hud who sank into alcoholism after accidentally killing his brother in a car crash
Erin Brockovich,/title/tt0195685/,Biography Drama             An unemployed single mother becomes a legal assistant and almost singlehandedly brings down a California power company accused of polluting a citys water supply
John Carter,/title/tt0401729/,Action Adventure SciFi             Transported to Barsoom a Civil War vet discovers a barren planet seemingly inhabited by 12foot tall barbarians Finding himself prisoner of these creatures he escapes only to encounter Woola and a princess in desperate need of a savior
