Titulo,URL,Descripcion
Avengers: Age of Ultron,/title/tt2395427/,Action Adventure SciFi             When Tony Stark and Bruce Banner try to jumpstart a dormant peacekeeping program called Ultron things go horribly wrong and its up to Earths mightiest heroes to stop the villainous Ultron from enacting his terrible plan
Star Wars: Episode II - Attack of the Clones,/title/tt0121765/,Action Adventure Fantasy             Ten years after initially meeting Anakin Skywalker shares a forbidden romance with Padmé Amidala while ObiWan Kenobi discovers a secret clone army crafted for the Jedi
The Hunger Games: Catching Fire,/title/tt1951264/,Action Adventure SciFi             Katniss Everdeen and Peeta Mellark become targets of the Capitol after their victory in the 74th Hunger Games sparks a rebellion in the Districts of Panem
Pitch Perfect 2,/title/tt2848292/,Comedy Music             After a humiliating command performance at The Kennedy Center the Barden Bellas enter an international competition that no American group has ever won in order to regain their status and right to perform
Blue Beetle,/title/tt9362930/,Action Adventure SciFi             A Mexican teenager finds an alien beetle that gives him superpowered armor
Jumanji: The Next Level,/title/tt7975244/,Action Adventure Comedy             In Jumanji The Next Level the gang is back but the game has changed As they return to rescue one of their own the players will have to brave parts unknown from arid deserts to snowy mountains to escape the worlds most dangerous game
Wonder,/title/tt2543472/,Drama Family             Based on the New York Times bestseller this movie tells the incredibly inspiring and heartwarming story of August Pullman a boy with facial differences who enters the fifth grade attending a mainstream elementary school for the first time
Thirteen,/title/tt0328538/,Drama             A thirteenyearold girls relationship with her mother is put to the test as she discovers drugs sex and petty crime in the company of her cool but troubled best friend
You People,/title/tt14826022/,Comedy Romance             Follows a new couple and their families who find themselves examining modern love and family dynamics amidst clashing cultures societal expectations and generational differences
American Gangster,/title/tt0765429/,Biography Crime Drama             An outcast New York City cop is charged with bringing down Harlem drug lord Frank Lucas whose real life inspired this partly biographical film
Mafia Mamma,/title/tt13923456/,Action Comedy Crime             An American mom inherits her grandfathers mafia empire in Italy Guided by the firms consigliere she hilariously defies everyones expectations as the new head of the family business
Inside Out,/title/tt2096673/,Animation Adventure Comedy             After young Riley is uprooted from her Midwest life and moved to San Francisco her emotions  Joy Fear Anger Disgust and Sadness  conflict on how best to navigate a new city house and school
Shrek,/title/tt0126029/,Animation Adventure Comedy             A mean lord exiles fairytale creatures to the swamp of a grumpy ogre who must go on a quest and rescue a princess for the lord in order to get his land back
Psycho,/title/tt0054215/,Horror Mystery Thriller             A Phoenix secretary embezzles 40000 from her employers client goes on the run and checks into a remote motel run by a young man under the domination of his mother
Clock,/title/tt17219484/,Horror Thriller             A woman enrolls in a clinical trial to try and fix her seemingly broken biological clock after friends family and society pressures her to have children
The Godfather Part III,/title/tt0099674/,Crime Drama             Follows Michael Corleone now in his 60s as he seeks to free his family from crime and find a suitable successor to his empire
Sleepless in Seattle,/title/tt0108160/,Comedy Drama Romance             A recently widowed mans son calls a radio talkshow in an attempt to find his father a partner
The Devil Wears Prada,/title/tt0458352/,Comedy Drama             A smart but sensible new graduate lands a job as an assistant to Miranda Priestly the demanding editorinchief of a high fashion magazine
The Black Demon,/title/tt10279472/,Horror SciFi Thriller             Stranded on a crumbling rig in Baja a family faces off against a vengeful megalodon shark
Orphan,/title/tt1148204/,Horror Mystery Thriller             A husband and wife who recently lost their baby adopt a 9yearold girl who is not nearly as innocent as she appears
Pokémon: Detective Pikachu,/title/tt5884052/,Action Adventure Comedy             In a world where people collect Pokémon to do battle a boy comes across an intelligent talking Pikachu who seeks to be a detective
American Hustle,/title/tt1800241/,Crime Drama             A con man Irving Rosenfeld along with his seductive partner Sydney Prosser is forced to work for a wild FBI Agent Richie DiMaso who pushes them into a world of Jersey powerbrokers and the Mafia
"Lyle, Lyle, Crocodile",/title/tt14668630/,Animation Adventure Comedy             Feature film based on the childrens book about a crocodile that lives in New York City
Primal Fear,/title/tt0117381/,Crime Drama Mystery             An altar boy is accused of murdering a priest and the truth is buried several layers deep
Reminiscence,/title/tt3272066/,Mystery Romance SciFi             Nick Bannister a private investigator of the mind navigates the alluring world of the past when his life is changed by new client Mae A simple case becomes an obsession after she disappears and he fights to learn the truth about her
The Empty Man,/title/tt5867314/,Drama Horror Mystery             On the trail of a missing girl an excop comes across a secretive group attempting to summon a terrifying supernatural entity
Sixteen Candles,/title/tt0088128/,Comedy Romance             A girls sweet sixteenth birthday is anything but special her family forgets about it and she suffers from every embarrassment possible
Friends with Benefits,/title/tt1632708/,Comedy Romance             A young man and woman decide to take their friendship to the next level without becoming a couple but soon discover that adding sex only leads to complications
Boogie Nights,/title/tt0118749/,Drama             Back when sex was safe pleasure was a business and business was booming an idealistic porn producer aspires to elevate his craft to an art when he discovers a hot young talent
Austin Powers: International Man of Mystery,/title/tt0118655/,Adventure Comedy             A worldclass playboy and parttime secret agent from the 1960s emerges after thirty years in a cryogenic state to battle with his nemesis Dr Evil
Emily the Criminal,/title/tt15255876/,Crime Drama Thriller             Down on her luck and saddled with debt Emily gets involved in a credit card scam that pulls her into the criminal underworld of Los Angeles ultimately leading to deadly consequences
Gangs of New York,/title/tt0217505/,Crime Drama             In 1862 Amsterdam Vallon returns to the Five Points area of New York City seeking revenge against Bill the Butcher his fathers killer
Edge of Tomorrow,/title/tt1631867/,Action Adventure SciFi             A soldier fighting aliens gets to relive the same day over and over again the day restarting every time he dies
Terminator: Dark Fate,/title/tt6450804/,Action Adventure SciFi             An augmented human and Sarah Connor must stop an advanced liquid Terminator from hunting down a young girl whose fate is critical to the human race
The Sixth Sense,/title/tt0167404/,Drama Mystery Thriller             Malcolm Crowe a child psychologist starts treating a young boy Cole who encounters dead people and convinces him to help them In turn Cole helps Malcolm reconcile with his estranged wife
Fast Times at Ridgemont High,/title/tt0083929/,Comedy Drama             A group of Southern California high school students are enjoying their most important subjects sex drugs and rock n roll
About Time,/title/tt2194499/,Comedy Drama Fantasy             At the age of 21 Tim discovers he can travel in time and change what happens and has happened in his own life His decision to make his world a better place by getting a girlfriend turns out not to be as easy as you might think
Men in Black 3,/title/tt1409024/,Action Adventure Comedy             Agent J travels in time to MIBs early days in 1969 to stop an alien from assassinating his friend Agent K and changing history
Spider-Man 3,/title/tt0413300/,Action Adventure SciFi             A strange black entity from another world bonds with Peter Parker and causes inner turmoil as he contends with new villains temptations and revenge
Logan,/title/tt3315342/,Action Drama SciFi             In a future where mutants are nearly extinct an elderly and weary Logan leads a quiet life But when Laura a mutant child pursued by scientists comes to him for help he must get her to safety
Flamin' Hot,/title/tt8105234/,Biography Drama History             This is the inspiring true story of Richard Montañez who as a Frito Lay janitor disrupted the food industry by channeling his Mexican heritage to turn Flamin Hot Cheetos from a snack into an iconic global pop culture phenomenon
Grown Ups,/title/tt1375670/,Comedy             After their high school basketball coach passes away five good friends and former teammates reunite for a Fourth of July holiday weekend
Jumanji,/title/tt0113497/,Adventure Comedy Family             When two kids find and play a magical board game they release a man trapped in it for decades  and a host of dangers that can only be stopped by finishing the game
The Incredibles,/title/tt0317705/,Animation Action Adventure             While trying to lead a quiet suburban life a family of undercover superheroes are forced into action to save the world
The Mask,/title/tt0110475/,Action Comedy Crime             Bank clerk Stanley Ipkiss is transformed into a manic superhero when he wears a mysterious mask
Weird: The Al Yankovic Story,/title/tt17076046/,Comedy Crime Music             Explores every facet of Yankovics life from his meteoric rise to fame with early hits like Eat It and Like a Surgeon to his torrid celebrity love affairs and famously depraved lifestyle
San Andreas,/title/tt2126355/,Action Adventure Thriller             In the aftermath of a massive earthquake in California a rescuechopper pilot makes a dangerous journey with his exwife across the state in order to rescue his daughter
Red Sparrow,/title/tt2873282/,Action Drama Thriller             Ballerina Dominika Egorova is recruited to Sparrow School a Russian intelligence service where she is forced to use her body as a weapon Her first mission targeting a CIA agent threatens to unravel the security of both nations
The Parent Trap,/title/tt0120783/,Adventure Comedy Drama             Identical twins Annie and Hallie separated at birth and each raised by one of their biological parents discover each other for the first time at summer camp and make a plan to bring their wayward parents back together
Charlie and the Chocolate Factory,/title/tt0367594/,Adventure Comedy Family             A young boy wins a tour through the most magnificent chocolate factory in the world led by the worlds most unusual candy maker
Home Alone,/title/tt0099785/,Comedy Family             An eightyearold troublemaker mistakenly left home alone must defend his home against a pair of burglars on Christmas eve
Moonfall,/title/tt5834426/,Action Adventure SciFi             A mysterious force knocks the moon from its orbit and sends it hurtling on a collision course toward earth
Poor Things,/title/tt14230458/,Romance SciFi             The incredible tale and fantastical evolution of Bella Baxter a young woman brought back to life by the brilliant and unorthodox scientist Dr Godwin Baxter
Ocean's Eleven,/title/tt0240772/,Crime Thriller             Danny Ocean and his ten accomplices plan to rob three Las Vegas casinos simultaneously
Final Destination,/title/tt0195714/,Horror Thriller             Alex Browning is among a group of high school students readying themselves for a trip to Europe When he suddenly has a premonition their airplane will crash he screams to warn the others but instead he is thrown off of the plane along others but the plane actually crashes after they get off Weeks later one of the survivors mysteriously dies and Alex realizes that things just got more complex
Frozen,/title/tt2294629/,Animation Adventure Comedy             When the newly crowned Queen Elsa accidentally uses her power to turn things into ice to curse her home in infinite winter her sister Anna teams up with a mountain man his playful reindeer and a snowman to change the weather condition
Bridesmaids,/title/tt1478338/,Comedy Romance             Competition between the maid of honor and a bridesmaid over who is the brides best friend threatens to upend the life of an outofwork pastry chef
Ghostbusters,/title/tt0087332/,Action Comedy Fantasy             Three parapsychologists forced out of their university funding set up shop as a unique ghost removal service in New York City attracting frightened yet skeptical customers
Mission: Impossible - Ghost Protocol,/title/tt1229238/,Action Adventure Thriller             The IMF is shut down when its implicated in the bombing of the Kremlin causing Ethan Hunt and his new team to go rogue to clear their organizations name
Past Lives,/title/tt13238346/,Drama Romance             Nora and Hae Sung two deeply connected childhood friends are wrest apart after Noras family emigrates from South Korea 20 years later they are reunited for one fateful week as they confront notions of love and destiny
Casino Royale,/title/tt0381061/,Action Adventure Thriller             After earning 00 status and a licence to kill secret agent James Bond sets out on his first mission as 007 Bond must defeat a private banker funding terrorists in a highstakes game of poker at Casino Royale Montenegro
Alive,/title/tt0106246/,Biography Drama Thriller             After crashlanding in the snowswept Andes a Uruguayan rugby team has no choice but to turn to desperate measures in order to survive
The Voyeurs,/title/tt11235772/,Drama Mystery Thriller             Pippa and Thomas move into their dream apartment they notice that their windows look directly into the apartment opposite this will set in motion a chain of events that will lead to disaster
The Perks of Being a Wallflower,/title/tt1659337/,Drama             Charlie a 15yearold introvert enters high school and is nervous about his new life When he befriends his seniors he learns to cope with his friends suicide and his tumultuous past
The Revenant,/title/tt1663202/,Action Adventure Drama             A frontiersman on a fur trading expedition in the 1820s fights for survival after being mauled by a bear and left for dead by members of his own hunting team
Uncle Buck,/title/tt0098554/,Comedy             Bachelor and allround slob Buck babysits his brothers rebellious teenage daughter and her cute younger brother and sister
Legend,/title/tt3569230/,Biography Crime Drama             Identical twin gangsters Ronald and Reginald Kray terrorize London during the 1960s
I Spit on Your Grave,/title/tt1242432/,Horror Thriller             A writer who is brutalized during her cabin retreat seeks revenge on her attackers who left her for dead
Finding Nemo,/title/tt0266543/,Animation Adventure Comedy             After his son is captured in the Great Barrier Reef and taken to Sydney a timid clownfish sets out on a journey to bring him home
Alice in Wonderland,/title/tt1014759/,Adventure Family Fantasy             Nineteenyearold Alice returns to the magical world from her childhood adventure where she reunites with her old friends and learns of her true destiny to end the Red Queens reign of terror
"Crazy, Stupid, Love.",/title/tt1570728/,Comedy Drama Romance             A middleaged husbands life changes dramatically when his wife asks him for a divorce He seeks to rediscover his manhood with the help of a newfound friend Jacob learning to pick up girls at bars
Les Misérables,/title/tt1707386/,Drama Musical Romance             In 19thcentury France Jean Valjean who for decades has been hunted by the ruthless policeman Javert after breaking parole agrees to care for a factory workers daughter The decision changes their lives forever
Into the Wild,/title/tt0758758/,Adventure Biography Drama             After graduating from Emory University top student and athlete Christopher McCandless abandons his possessions gives his entire 24000 savings account to charity and hitchhikes to Alaska to live in the wilderness Along the way Christopher encounters a series of characters that shape his life
Heartbreak Ridge,/title/tt0091187/,Drama War             Hardnosed hardliving Marine Gunnery Sergeant Tom Highway Clint Eastwood clashes with his superiors and his exwife as he takes command of a spoiled recon platoon with a bad attitude
Airplane!,/title/tt0080339/,Comedy             After the crew becomes sick with food poisoning a neurotic exfighter pilot must land a commercial airplane full of passengers safely
Insidious: The Red Door,/title/tt13405778/,Horror Mystery Thriller             The Lamberts 10 years after the last installment as Dalton begins college
Kraven the Hunter,/title/tt8790086/,Action Adventure SciFi             Russian immigrant Sergei Kravinoff is on a mission to prove that he is the greatest hunter in the world
Avengers: Secret Wars,/title/tt21361444/,Action Adventure SciFi             Plot under wraps
Terrifier,/title/tt4281724/,Horror Thriller             On Halloween night Tara Heyes finds herself as the obsession of a sadistic murderer known as Art the Clown
The Killer,/title/tt1136617/,Action Adventure Crime             An assassin begins to psychologically crack as he develops a conscience even as his clients continue to demand his skills
Gerald's Game,/title/tt3748172/,Drama Horror Thriller             A couple tries to spice up their marriage in a remote lake house After the husband dies unexpectedly the wife is left handcuffed to their bed frame and must fight to survive and break free
Unfaithful,/title/tt0250797/,Drama Romance Thriller             A New York suburban couples marriage goes dangerously awry when the wife indulges in an adulterous fling
Atonement,/title/tt0783233/,Drama Mystery Romance             Thirteenyearold fledgling writer Briony Tallis irrevocably changes the course of several lives when she accuses her older sisters lover of a crime he did not commit
Strange World,/title/tt10298840/,Animation Action Adventure             The legendary Clades are a family of explorers whose differences threaten to topple their latest and most crucial mission
Spotlight,/title/tt1895587/,Biography Crime Drama             The true story of how the Boston Globe uncovered the massive scandal of child molestation and coverup within the local Catholic Archdiocese shaking the entire Catholic Church to its core
Licorice Pizza,/title/tt11271038/,Comedy Drama Romance             The story of Alana Kane and Gary Valentine growing up running around and going through the treacherous navigation of first love in the San Fernando Valley 1973
Scent of a Woman,/title/tt0105323/,Drama             A prep school student needing money agrees to babysit a blind man but the job is not at all what he anticipated
"Three Billboards Outside Ebbing, Missouri",/title/tt5027774/,Comedy Crime Drama             A mother personally challenges the local authorities to solve her daughters murder when they fail to catch the culprit
The Best Man,/title/tt13400336/,Action Thriller             Mercenaries seize control of a remote resort hotel during a wedding and its up to the best man the groom and their drunken best friend to stop the terrorists and save the hostages
Mission: Impossible III,/title/tt0317919/,Action Adventure Thriller             IMF agent Ethan Hunt comes into conflict with a dangerous and sadistic arms dealer who threatens his life and his fiancée in response
White Chicks,/title/tt0381707/,Comedy Crime             Two disgraced FBI agents go way undercover in an effort to protect hotel heiresses the Wilson sisters from a kidnapping plot
The Devil All the Time,/title/tt7395114/,Crime Drama Thriller             Sinister characters converge around a young man devoted to protecting those he loves in a postwar backwoods town teeming with corruption and brutality
Flight,/title/tt1907668/,Drama Thriller             An airline pilot saves almost all his passengers on his malfunctioning airliner which eventually crashed but an investigation into the accident reveals something troubling
Consecration,/title/tt14993352/,Horror Thriller             After the alleged suicide of her priest brother Grace travels to the remote Scottish convent where he fell to his death Distrusting the Churchs account she uncovers murder sacrilege and a disturbing truth about herself
The School for Good and Evil,/title/tt2935622/,Action Comedy Drama             Best friends Sophie and Agatha find themselves on opposing sides of an epic battle when theyre swept away into an enchanted school where aspiring heroes and villains are trained to protect the balance between Good and Evil
Violent Night,/title/tt12003946/,Action Comedy Crime             When a group of mercenaries attack the estate of a wealthy family Santa Claus must step in to save the day and Christmas
The Hitchhiker's Guide to the Galaxy,/title/tt0371724/,Adventure Comedy SciFi             Mere seconds before the Earth is to be demolished by an alien construction crew journeyman Arthur Dent is swept off the planet by his friend Ford Prefect a researcher penning a new edition of The Hitchhikers Guide to the Galaxy
Black Mass,/title/tt1355683/,Biography Crime Drama             The true story of Whitey Bulger the brother of a state senator and the most infamous violent criminal in the history of South Boston who became an FBI informant to take down a Mafia family invading his turf
The Lost City,/title/tt13320622/,Action Adventure Comedy             A reclusive romance novelist on a book tour with her cover model gets swept up in a kidnapping attempt that lands them both in a cutthroat jungle adventure
Crazy Rich Asians,/title/tt3104988/,Comedy Drama Romance             This contemporary romantic comedy based on a global bestseller follows native New Yorker Rachel Chu to Singapore to meet her boyfriends family
Man of Steel,/title/tt0770828/,Action Adventure SciFi             An alien child is evacuated from his dying world and sent to Earth to live among humans His peace is threatened when other survivors of his home planet invade Earth
Happy Gilmore,/title/tt0116483/,Comedy Sport             A rejected hockey player puts his skills to the golf course to save his grandmothers house
Gifted,/title/tt4481414/,Drama             Frank a single man raising his child prodigy niece Mary is drawn into a custody battle with his mother
Lady Bird,/title/tt4925292/,Comedy Drama             In 2002 an artistically inclined 17yearold girl comes of age in Sacramento California
You Should Have Left,/title/tt8201852/,Horror Thriller             A former banker his actress wife and their spirited daughter book a vacation at an isolated modern home in the Welsh countryside where nothing is quite as it seems
Solo: A Star Wars Story,/title/tt3778644/,Action Adventure SciFi             Board the Millennium Falcon and journey to a galaxy far far away in an epic actionadventure that will set the course of one of the Star Wars sagas most unlikely heroes
The Wonder,/title/tt9288822/,Drama Mystery Thriller             A tale of two strangers who transform each others lives a psychological thriller and a story of love pitted against evil
Beverly Hills Cop,/title/tt0086960/,Action Comedy Crime             A freewheeling Detroit cop pursuing a murder investigation finds himself dealing with the very different culture of Beverly Hills
Room,/title/tt3170832/,Drama Thriller             A little boy is held captive in a room with his mother since his birth so he has never known the world outside
Thunderball,/title/tt0059800/,Action Adventure Thriller             James Bond heads to the Bahamas to recover two nuclear warheads stolen by SPECTRE Agent Emilio Largo in an international extortion scheme
Zodiac,/title/tt0443706/,Crime Drama Mystery             Between 1968 and 1983 a San Francisco cartoonist becomes an amateur detective obsessed with tracking down the Zodiac Killer an unidentified individual who terrorizes Northern California with a killing spree
Red Notice,/title/tt7991608/,Action Comedy Thriller             An Interpol agent successfully tracks down the worlds most wanted art thief with help from a rival thief But nothing is as it seems as a series of doublecrosses ensues
Fifty Shades Darker,/title/tt4465564/,Drama Romance Thriller             While Christian wrestles with his inner demons Anastasia must confront the anger and envy of the women who came before her
The Old Way,/title/tt8593824/,Action Drama Western             An old gunslinger and his daughter must face the consequences of his past when the son of a man he murdered years ago arrives to take his revenge
The Lighthouse,/title/tt7984734/,Drama Fantasy Mystery             Two lighthouse keepers try to maintain their sanity while living on a remote and mysterious New England island in the 1890s
Coco,/title/tt2380307/,Animation Adventure Comedy             Aspiring musician Miguel confronted with his familys ancestral ban on music enters the Land of the Dead to find his greatgreatgrandfather a legendary singer
