Titulo,URL,Descripcion
The Little Mermaid,/title/tt5971474/,Adventure Family Fantasy             A young mermaid makes a deal with a sea witch to trade her beautiful voice for human legs so she can discover the world above water and impress a prince
Fast X,/title/tt5433140/,Action Adventure Crime             Dom Toretto and his family are targeted by the vengeful son of drug kingpin Hernan Reyes
Guardians of the Galaxy Vol. 3,/title/tt6791350/,Action Adventure Comedy             Still reeling from the loss of Gamora Peter Quill rallies his team to defend the universe and one of their own  a mission that could mean the end of the Guardians if not successful
Killers of the Flower Moon,/title/tt5537002/,Crime Drama History             Members of the Osage tribe in the United States are murdered under mysterious circumstances in the 1920s sparking a major FBI investigation involving J Edgar Hoover
John Wick: Chapter 4,/title/tt10366206/,Action Crime Thriller             John Wick uncovers a path to defeating The High Table But before he can earn his freedom Wick must face off against a new enemy with powerful alliances across the globe and forces that turn old friends into foes
Dungeons & Dragons: Honor Among Thieves,/title/tt2906216/,Action Adventure Comedy             A charming thief and a band of unlikely adventurers embark on an epic quest to retrieve a lost relic but things go dangerously awry when they run afoul of the wrong people
The Super Mario Bros. Movie,/title/tt6718170/,Animation Adventure Comedy             A plumber named Mario travels through an underground labyrinth with his brother Luigi trying to save a captured princess
Ant-Man and the Wasp: Quantumania,/title/tt10954600/,Action Adventure Comedy             Scott Lang and Hope Van Dyne are dragged into the Quantum Realm along with Hopes parents and Scotts daughter Cassie Together they must find a way to escape but what secrets is Hopes mother hiding And who is the mysterious Kang
Air,/title/tt16419074/,Drama Sport             Follows the history of shoe salesman Sonny Vaccaro and how he led Nike in its pursuit of the greatest athlete in the history of basketball Michael Jordan
The Flash,/title/tt0439572/,Action Adventure Fantasy             Barry Allen uses his super speed to change the past but his attempt to save his family creates a world without super heroes forcing him to race for his life in order to save the future
Barbie,/title/tt1517268/,Adventure Comedy Fantasy             To live in Barbie Land is to be a perfect being in a perfect place Unless you have a fullon existential crisis Or youre a Ken
The Mother,/title/tt6968614/,Action Thriller             While fleeing from dangerous assailants an assassin comes out of hiding to protect the daughter she left earlier in life
Indiana Jones and the Dial of Destiny,/title/tt1462764/,Action Adventure             Archaeologist Indiana Jones races against time to retrieve a legendary artifact that can change the course of history
White Men Can't Jump,/title/tt6436620/,Comedy Drama Sport             A remake of the 1992 film about a pair of basketball hustlers who team up to earn extra cash
The Covenant,/title/tt4873118/,Action Thriller War             During the war in Afghanistan a local interpreter risks his own life to carry an injured sergeant across miles of grueling terrain
Evil Dead Rise,/title/tt13345606/,Horror             A twisted tale of two estranged sisters whose reunion is cut short by the rise of fleshpossessing demons thrusting them into a primal battle for survival as they face the most nightmarish version of family imaginable
The Machine,/title/tt11040844/,Action Comedy             Berts drunken past catches up with him 20 years down the road when he and his father are kidnapped by those Bert wronged 20 years ago while drunk on a college semester abroad in Russia
Shazam! Fury of the Gods,/title/tt10151854/,Action Adventure Comedy             The film continues the story of teenage Billy Batson who upon reciting the magic word SHAZAM is transformed into his adult Super Hero alter ego Shazam
A Man Called Otto,/title/tt7405458/,Comedy Drama             Otto is a grump whos given up on life following the loss of his wife and wants to end it all When a young family moves in nearby he meets his match in quickwitted Marisol leading to a friendship that will turn his world around
Asteroid City,/title/tt14230388/,Comedy Drama Romance             The itinerary of a Junior Stargazer convention is spectacularly disrupted by worldchanging events
Five Nights at Freddy's,/title/tt4589218/,Horror             A troubled security guard begins working at Freddy Fazbears Pizza During his first night on the job he realizes that the night shift at Freddys wont be so easy to get through
Spider-Man: Across the Spider-Verse,/title/tt9362722/,Animation Action Adventure             Miles Morales catapults across the Multiverse where he encounters a team of SpiderPeople charged with protecting its very existence When the heroes clash on how to handle a new threat Miles must redefine what it means to be a hero
The Color Purple,/title/tt1200263/,Drama Musical             Musical adaptation of Alice Walkers novel about the lifelong struggles of an African American woman living in the south during the early 1900s
Mission: Impossible - Dead Reckoning Part One,/title/tt9603212/,Action Adventure Thriller             Ethan Hunt and his IMF team must track down a dangerous weapon before it falls into the wrong hands
To Catch a Killer,/title/tt10275534/,Action Crime Drama             Baltimore New Years Eve A talented but troubled police officer Shailene Woodley is recruited by the FBIs chief investigator Ben Mendelsohn to help profile and track down a disturbed individual terrorizing the city
Oppenheimer,/title/tt15398776/,Biography Drama History             The story of American scientist J Robert Oppenheimer and his role in the development of the atomic bomb
The Creator,/title/tt11858890/,Action Adventure Drama             Described as a postapocalyptic thriller involving a future impacted by a war between humans and AI
Missing,/title/tt10855768/,Drama Mystery Thriller             After her mother goes missing a young woman tries to find her from home using tools available to her online
F9: The Fast Saga,/title/tt5433138/,Action Crime Thriller             Dom and the crew must take on an international terrorist who turns out to be Dom and Mias estranged brother
Transformers: Rise of the Beasts,/title/tt5090568/,Action Adventure SciFi             During the 90s a new faction of Transformers  the Maximals  join the Autobots as allies in the battle for Earth
Beau Is Afraid,/title/tt13521006/,Comedy Drama Horror             Following the sudden death of his mother a mildmannered but anxietyridden man confronts his darkest fears as he embarks on an epic Kafkaesque odyssey back home
Kandahar,/title/tt5761544/,Action Thriller             A CIA operative and his translator flee from special forces in Afghanistan after exposing a covert mission
No Hard Feelings,/title/tt15671028/,Comedy             On the brink of losing her home Maddie finds an intriguing job listing helicopter parents looking for someone to bring their introverted 19yearold son out of his shell before college She has one summer to make him a man or die trying
Love Again,/title/tt10276482/,Comedy Drama Romance             A young woman tries to ease the pain of her fiancés death by sending romantic texts to his old cell phone number and forms a connection with the man the number has been reassigned to
Scream VI,/title/tt17663992/,Horror Mystery Thriller             In the next installment the survivors of the Ghostface killings leave Woodsboro behind and start a fresh chapter in New York City
X,/title/tt13560574/,Horror Mystery Thriller             In 1979 a group of young filmmakers set out to make an adult film in rural Texas but when their reclusive elderly hosts catch them in the act the cast find themselves fighting for their lives
Renfield,/title/tt11358390/,Comedy Fantasy Horror             Renfield Draculas henchman and inmate at the lunatic asylum for decades longs for a life away from the Count his various demands and all of the bloodshed that comes with them
The Fast and the Furious,/title/tt0232500/,Action Crime Thriller             Los Angeles police officer Brian OConner must decide where his loyalty really lies when he becomes enamored with the street racing world he has been sent undercover to destroy
The Pope's Exorcist,/title/tt13375076/,Horror Thriller             Follow Gabriele Amorth the Vaticans leading exorcist as he investigates the possession of a child and uncovers a conspiracy the Vatican has tried to keep secret
Guardians of the Galaxy,/title/tt2015381/,Action Adventure Comedy             A group of intergalactic criminals must pull together to stop a fanatical warrior with plans to purge the universe
Ghosted,/title/tt15326988/,Action Adventure Comedy             Cole falls head over heels for enigmatic Sadie but then makes the shocking discovery that shes a secret agent Before they can decide on a second date Cole and Sadie are swept away on an international adventure to save the world
May December,/title/tt13651794/,Drama Romance             Twenty years after their notorious tabloid romance gripped the nation a married couple buckles under the pressure when an actress arrives to do research for a film about their past
About My Father,/title/tt8373206/,Comedy             When Sebastian tells his oldschool Italian immigrant father Salvo that he is going to propose to his allAmerican girlfriend Salvo insists on crashing a weekend with her tony parents
Avatar: The Way of Water,/title/tt1630029/,Action Adventure Fantasy             Jake Sully lives with his newfound family formed on the extrasolar moon Pandora Once a familiar threat returns to finish what was previously started Jake must work with Neytiri and the army of the Navi race to protect their home
Thor,/title/tt0800369/,Action Fantasy             The powerful but arrogant god Thor is cast out of Asgard to live amongst humans in Midgard Earth where he soon becomes one of their finest defenders
Top Gun: Maverick,/title/tt1745960/,Action Drama             After thirty years Maverick is still pushing the envelope as a top naval aviator but must confront ghosts of his past when he leads TOP GUNs elite graduates on a mission that demands the ultimate sacrifice from those chosen to fly it
The Meg 2: The Trench,/title/tt9224104/,Action Adventure Horror             Plot unknown Sequel to the 2018 film The Meg
The Zone of Interest,/title/tt7160372/,Drama History War             The commandant of Auschwitz Rudolf Höss and his wife Hedwig strive to build a dream life for their family in a house and garden next to the camp
White Men Can't Jump,/title/tt0105812/,Comedy Sport             Black and white basketball hustlers join forces to double their chances of winning money on the street courts and in a basketball tournament
Everything Everywhere All at Once,/title/tt6710474/,Action Adventure Comedy             A middleaged Chinese immigrant is swept up into an insane adventure in which she alone can save existence by exploring other universes and connecting with the lives she could have led
Heat,/title/tt0113277/,Action Crime Drama             A group of highend professional thieves start to feel the heat from the LAPD when they unknowingly leave a clue at their latest heist
The Godfather,/title/tt0068646/,Crime Drama             Don Vito Corleone head of a mafia family decides to hand over his empire to his youngest son Michael However his decision unintentionally puts the lives of his loved ones in grave danger
Robots,/title/tt12579470/,Comedy Romance SciFi             Charles is a womanizer while Elaine is a gold digger The duo learn humanity when forced to team up and pursue robot doubles of themselves
Peter Pan & Wendy,/title/tt5635026/,Action Adventure Comedy             Follow the adventures of Peter Pan a boy who does not want to grow up and how he recruits three siblings in London and together they embark on a magical adventure on the enchanted island of Neverland
Hypnotic,/title/tt8080204/,Action Mystery Thriller             A detective investigates a mystery involving his missing daughter and a secret government program
The Menu,/title/tt9764362/,Comedy Horror Thriller             A young couple travels to a remote island to eat at an exclusive restaurant where the chef has prepared a lavish menu with some shocking surprises
What's Love Got to Do with It,/title/tt0108551/,Biography Drama Music             The story of singer Tina Turners rise to stardom and how she gained the courage to break free from her abusive husband Ike Turner
65,/title/tt12261776/,Action Adventure Drama             An astronaut crash lands on a mysterious planet only to discover hes not alone
Dune,/title/tt1160419/,Action Adventure Drama             A noble family becomes embroiled in a war for control over the galaxys most valuable asset while its heir becomes troubled by visions of a dark future
Interstellar,/title/tt0816692/,Adventure Drama SciFi             When Earth becomes uninhabitable in the future a farmer and exNASA pilot Joseph Cooper is tasked to pilot a spacecraft along with a team of researchers to find a new planet for humans
The Shawshank Redemption,/title/tt0111161/,Drama             Over the course of several years two convicts form a friendship seeking consolation and eventually redemption through basic compassion
John Wick,/title/tt2911666/,Action Crime Thriller             An exhitman comes out of retirement to track down the gangsters who killed his dog and stole his car
The Boogeyman,/title/tt3427252/,Horror Mystery Thriller             Still reeling from the tragic death of their mother a teenage girl and her younger sister find themselves plagued by a sadistic presence in their house and struggle to get their grieving father to pay attention before its too late
Firebrand,/title/tt15000156/,Drama History Horror             Follows Queen Catherine Parr and Henry VIIIs marriage
Cocaine Bear,/title/tt14209916/,Comedy Thriller             An oddball group of cops criminals tourists and teens converge on a Georgia forest where a huge black bear goes on a murderous rampage after unintentionally ingesting cocaine
Furious 7,/title/tt2820852/,Action Crime Thriller             Deckard Shaw seeks revenge against Dominic Toretto and his family for his comatose brother
Dune: Part Two,/title/tt15239678/,Action Adventure Drama             A boy becomes the Messiah of nomads on a desert planet that has giant worms that protect a commodity called Spice Spice changes people into travelers mystics and madmen What price will he pay to become the new ruler of their universe
Bullet Train,/title/tt12593682/,Action Comedy Thriller             Five assassins aboard a swiftlymoving bullet train find out that their missions have something in common
Guardians of the Galaxy Vol. 2,/title/tt3896198/,Action Adventure Comedy             The Guardians struggle to keep together as a team while dealing with their personal family issues notably StarLords encounter with his father the ambitious celestial being Ego
Girl in the Basement,/title/tt13269536/,Crime Thriller             Sarah is a teen girl who is looking forward to her 18th birthday to move away from her controlling father Don But before she could even blow out the candles Don imprisons her in the basement of their home
The Little Mermaid,/title/tt0097757/,Animation Adventure Family             A mermaid princess makes a Faustian bargain in an attempt to become human and win a princes love
Harry Potter and the Sorcerer's Stone,/title/tt0241527/,Adventure Family Fantasy             An orphaned boy enrolls in a school of wizardry where he learns the truth about himself his family and the terrible evil that haunts the magical world
Operation Fortune: Ruse de Guerre,/title/tt7985704/,Action Comedy Thriller             Special agent Orson Fortune and his team of operatives recruit one of Hollywoods biggest movie stars to help them on an undercover mission when the sale of a deadly new weapons technology threatens to disrupt the world order
Beetlejuice 2,/title/tt2049403/,Comedy Fantasy Horror             This is a followup to the comedy Beetlejuice 1988 about a ghost whos recruited to help haunt a house
Pearl,/title/tt18925334/,Drama Horror Thriller             In 1918 a young woman on the brink of madness pursues stardom in a desperate attempt to escape the drudgery isolation and lovelessness of life on her parents farm
Fast Five,/title/tt1596343/,Action Crime Thriller             Dominic Toretto and his crew of street racers plan a massive heist to buy their freedom while in the sights of a powerful Brazilian drug lord and a dangerous federal agent
Babylon,/title/tt10640346/,Comedy Drama History             A tale of outsized ambition and outrageous excess it traces the rise and fall of multiple characters during an era of unbridled decadence and depravity in early Hollywood
Spider-Man: Into the Spider-Verse,/title/tt4633694/,Animation Action Adventure             Teen Miles Morales becomes the SpiderMan of his universe and must join with five spiderpowered individuals from other dimensions to stop a threat for all realities
Fast & Furious,/title/tt1013752/,Action Crime Thriller             Brian OConner back working for the FBI in Los Angeles teams up with Dominic Toretto to bring down a heroin importer by infiltrating his operation
The Whale,/title/tt13833688/,Drama             A reclusive morbidly obese English teacher attempts to reconnect with his estranged teenage daughter
"Are You There God? It's Me, Margaret.",/title/tt9185206/,Comedy Drama Family             When her family moves from the city to the suburbs 11yearold Margaret navigates new friends feelings and the beginning of adolescence
Triangle of Sadness,/title/tt7322224/,Comedy Drama             A fashion model celebrity couple join an eventful cruise for the superrich
The Fate of the Furious,/title/tt4630562/,Action Crime Thriller             When a mysterious woman seduces Dominic Toretto into the world of terrorism and a betrayal of those closest to him the crew face trials that will test them as never before
The Color Purple,/title/tt0088939/,Drama             A black Southern woman struggles to find her identity after suffering abuse from her father and others over four decades
The Fabelmans,/title/tt14208870/,Drama             Growing up in postWorld War II era Arizona young Sammy Fabelman aspires to become a filmmaker as he reaches adolescence but soon discovers a shattering family secret and explores how the power of films can help him see the truth
You Hurt My Feelings,/title/tt15771916/,Comedy Drama             A novelists longstanding marriage is suddenly upended when she overhears her husband giving his honest reaction to her latest book
Nefarious,/title/tt14537248/,Horror Thriller             On the day of his scheduled execution a convicted serial killer gets a psychiatric evaluation during which he claims he is a demon and further claims that before their time is over the psychiatrist will commit three murders of his own
Once Upon a Time in Hollywood,/title/tt7131622/,Comedy Drama             A faded television actor and his stunt double strive to achieve fame and success in the final years of Hollywoods Golden Age in 1969 Los Angeles
Fall,/title/tt15325794/,Thriller             Best friends Becky and Hunter find themselves at the top of a 2000foot radio tower
Inception,/title/tt1375666/,Action Adventure SciFi             A thief who steals corporate secrets through the use of dreamsharing technology is given the inverse task of planting an idea into the mind of a CEO but his tragic past may doom the project and his team to disaster
The Batman,/title/tt1877830/,Action Crime Drama             When a sadistic serial killer begins murdering key political figures in Gotham Batman is forced to investigate the citys hidden corruption and question his familys involvement
The Wolf of Wall Street,/title/tt0993846/,Biography Comedy Crime             Based on the true story of Jordan Belfort from his rise to a wealthy stockbroker living the high life to his fall involving crime corruption and the federal government
Book Club: The Next Chapter,/title/tt20768712/,Comedy             Follows the new journey of four best friends as they take their book club to Italy for the fun girls trip they never had
Furious 6,/title/tt1905041/,Action Adventure Crime             Hobbs has Dominic and Brian reassemble their crew to take down a team of mercenaries Dominic unexpectedly gets sidetracked with facing his presumed deceased girlfriend Letty
Midsommar,/title/tt8772262/,Drama Horror Mystery             A couple travels to Northern Europe to visit a rural hometowns fabled Swedish midsummer festival What begins as an idyllic retreat quickly devolves into an increasingly violent and bizarre competition at the hands of a pagan cult
Spider-Man: No Way Home,/title/tt10872600/,Action Adventure Fantasy             With SpiderMans identity now revealed Peter asks Doctor Strange for help When a spell goes wrong dangerous foes from other worlds start to appear forcing Peter to discover what it truly means to be SpiderMan
Knock at the Cabin,/title/tt15679400/,Horror Mystery Thriller             While vacationing a girl and her parents are taken hostage by armed strangers who demand that the family make a choice to avert the apocalypse
Pulp Fiction,/title/tt0110912/,Crime Drama             The lives of two mob hitmen a boxer a gangster and his wife and a pair of diner bandits intertwine in four tales of violence and redemption
Tetris,/title/tt12758060/,Biography Drama History             The story of how one of the worlds most popular video games found its way to players around the globe Businessman Henk Rogers and Tetris inventor Alexey Pajitnov join forces in the USSR risking it all to bring Tetris to the masses
The Dark Knight,/title/tt0468569/,Action Crime Drama             When the menace known as the Joker wreaks havoc and chaos on the people of Gotham Batman must accept one of the greatest psychological and physical tests of his ability to fight injustice
She Said,/title/tt14807308/,Drama History             New York Times reporters Megan Twohey and Jodi Kantor break one of the most important stories in a generation  a story that helped ignite a movement and shattered decades of silence around the subject of sexual assault in Hollywood
Thor: Love and Thunder,/title/tt10648342/,Action Adventure Comedy             Thor enlists the help of Valkyrie Korg and exgirlfriend Jane Foster to fight Gorr the God Butcher who intends to make the gods extinct
Avengers: Endgame,/title/tt4154796/,Action Adventure Drama             After the devastating events of Avengers Infinity War 2018 the universe is in ruins With the help of remaining allies the Avengers assemble once more in order to reverse Thanos actions and restore balance to the universe
The Suicide Squad,/title/tt6334354/,Action Adventure Comedy             Supervillains Harley Quinn Bloodsport Peacemaker and a collection of nutty cons at Belle Reve prison join the supersecret supershady Task Force X as they are dropped off at the remote enemyinfused island of Corto Maltese
The Fast and the Furious: Tokyo Drift,/title/tt0463985/,Action Crime Thriller             A teenager becomes a major competitor in the world of drift racing after moving in with his father in Tokyo to avoid a jail sentence in America
Ted,/title/tt1637725/,Comedy             John Bennett a man whose childhood wish of bringing his teddy bear to life came true now must decide between keeping the relationship with the bear Ted or his girlfriend Lori
Old,/title/tt10954652/,Drama Horror Mystery             A vacationing family discovers that the secluded beach where theyre relaxing for a few hours is somehow causing them to age rapidly reducing their entire lives into a single day
Creed III,/title/tt11145118/,Drama Sport             Adonis has been thriving in both his career and family life but when a childhood friend and former boxing prodigy resurfaces the faceoff is more than just a fight
Plane,/title/tt5884796/,Action Adventure Thriller             A pilot finds himself caught in a war zone after hes forced to land his commercial aircraft during a terrible storm
Elemental,/title/tt15789038/,Animation Adventure Comedy             Follows Ember and Wade in a city where fire water land and airresidents live together
Expend4bles,/title/tt3291150/,Action Adventure Thriller             The Expendables will square up against an arms dealer who commands the might of a massive private army
Titanic,/title/tt0120338/,Drama Romance             A seventeenyearold aristocrat falls in love with a kind but poor artist aboard the luxurious illfated RMS Titanic
John Wick: Chapter 3 - Parabellum,/title/tt6146586/,Action Crime Thriller             John Wick is on the run after killing a member of the international assassins guild and with a 14 million price tag on his head he is the target of hit men and women everywhere
Shazam!,/title/tt0448115/,Action Adventure Comedy             A newly fostered young boy in search of his mother instead finds unexpected super powers and soon gains a powerful enemy
Puss in Boots: The Last Wish,/title/tt3915174/,Animation Adventure Comedy             When Puss in Boots discovers that his passion for adventure has taken its toll and he has burned through eight of his nine lives he launches an epic journey to restore them by finding the mythical Last Wish
