Titulo,URL,Descripcion
Avengers: Infinity War,/title/tt4154756/,Action Adventure SciFi             The Avengers and their allies must be willing to sacrifice all in an attempt to defeat the powerful Thanos before his blitz of devastation and ruin puts an end to the universe
Harry Potter and the Goblet of Fire,/title/tt0330373/,Adventure Family Fantasy             Harry Potter finds himself competing in a hazardous tournament between rival schools of magic but he is distracted by recurring nightmares
Terrifier 2,/title/tt10403420/,Horror             After being resurrected by a sinister entity Art the Clown returns to the timid town of Miles County where he targets a teenage girl and her younger brother on Halloween night
A League of Their Own,/title/tt0104694/,Comedy Drama Sport             Two sisters join the first female professional baseball league and struggle to help it succeed amid their own growing rivalry
The Gray Man,/title/tt1649418/,Action Thriller             When the CIAs most skilled operative whose true identity is known to none accidentally uncovers dark agency secrets a psychopathic former colleague puts a bounty on his head setting off a global manhunt by international assassins
The Three Musketeers,/title/tt1509767/,Action Adventure Fantasy             The hotheaded young DArtagnan along with three former legendary but now downontheirluck Musketeers must unite and defeat a beautiful double agent and her villainous employer from seizing the French throne and engulfing Europe in war
American Beauty,/title/tt0169547/,Drama             A sexually frustrated suburban father has a midlife crisis after becoming infatuated with his daughters best friend
It,/title/tt1396484/,Horror             In the summer of 1989 a group of bullied kids band together to destroy a shapeshifting monster which disguises itself as a clown and preys on the children of Derry their small Maine town
Idiocracy,/title/tt0387808/,Adventure Comedy SciFi             Corporal Joe Bauers a decisively average American is selected as a guinea pig for a topsecret hibernation program but is forgotten awakening to a future so incredibly moronic hes easily the most intelligent person alive
The Godfather Part II,/title/tt0071562/,Crime Drama             The early life and career of Vito Corleone in 1920s New York City is portrayed while his son Michael expands and tightens his grip on the family crime syndicate
Carrie,/title/tt1939659/,Drama Horror Thriller             A shy girl outcast by her peers and sheltered by her religious mother unleashes telekinetic terror on her small town after being pushed too far at her senior prom
The Shining,/title/tt0081505/,Drama Horror             A family heads to an isolated hotel for the winter where a sinister presence influences the father into violence while his psychic son sees horrific forebodings from both past and future
Champions,/title/tt15339570/,Comedy Drama Sport             A former minorleague basketball coach is ordered by the court to manage a team of players with intellectual disabilities He soon realizes that despite his doubts together this team can go further than they ever imagined
The Goonies,/title/tt0089218/,Adventure Comedy Family             A group of young misfits called The Goonies discover an ancient map and set out on an adventure to find a legendary pirates longlost treasure
American Pie,/title/tt0163651/,Comedy             Four teenage boys enter a pact to lose their virginity by prom night
Joker,/title/tt7286456/,Crime Drama Thriller             The rise of Arthur Fleck from aspiring standup comedian and pariah to Gothams clown prince and leader of the revolution
Troy,/title/tt0332452/,Drama             An adaptation of Homers great epic the film follows the assault on Troy by the united Greek forces and chronicles the fates of the men involved
To All the Boys I've Loved Before,/title/tt3846674/,Comedy Drama Romance             A teenage girls secret love letters are exposed and wreak havoc on her love life
Jaws,/title/tt0073195/,Adventure Mystery Thriller             When a killer shark unleashes chaos on a beach community off Cape Cod its up to a local sheriff a marine biologist and an old seafarer to hunt the beast down
Amsterdam,/title/tt10304142/,Comedy Drama History             In the 1930s three friends witness a murder are framed for it and uncover one of the most outrageous plots in American history
Casablanca,/title/tt0034583/,Drama Romance War             A cynical expatriate American cafe owner struggles to decide whether or not to help his former lover and her fugitive husband escape the Nazis in French Morocco
The Evil Dead,/title/tt0083907/,Horror             Five friends travel to a cabin in the woods where they unknowingly release fleshpossessing demons
Avatar,/title/tt0499549/,Action Adventure Fantasy             A paraplegic Marine dispatched to the moon Pandora on a unique mission becomes torn between following his orders and protecting the world he feels is his home
School of Rock,/title/tt0332379/,Comedy Music             After being kicked out of his rock band Dewey Finn becomes a substitute teacher of an uptight elementary private school only to try and turn his class into a rock band
Extraction 2,/title/tt12263384/,Action Thriller             After barely surviving his grievous wounds from his mission in Dhaka Bangladesh Tyler Rake is back and his team is ready to take on their next mission
Knives Out,/title/tt8946378/,Comedy Crime Drama             A detective investigates the death of the patriarch of an eccentric combative family
Wifelike,/title/tt15978956/,SciFi Thriller             When artificial human Meredith is assigned as a companion to grieving widower William she is designed to behave like his late wife But in the fight to end AI exploitation an organization attempts to sabotage her programming
Requiem for a Dream,/title/tt0180093/,Drama             The druginduced utopias of four Coney Island people are shattered when their addictions run deep
"Ruby Gillman, Teenage Kraken",/title/tt27155038/,Animation Action Adventure             A shy adolescent learns that she comes from a fabled royal family of legendary sea krakens and that her destiny lies in the depths of the waters which is bigger than she could have ever imagined
Spider-Man: Homecoming,/title/tt2250912/,Action Adventure SciFi             Peter Parker balances his life as an ordinary high school student in Queens with his superhero alterego SpiderMan and finds himself on the trail of a new menace prowling the skies of New York City
Star Trek Into Darkness,/title/tt1408101/,Action Adventure SciFi             After the crew of the Enterprise find an unstoppable force of terror from within their own organization Captain Kirk leads a manhunt to a warzone world to capture a oneman weapon of mass destruction
The Northman,/title/tt11138512/,Action Adventure Drama             A young Viking prince is on a quest to avenge his fathers murder
Bodies Bodies Bodies,/title/tt8110652/,Comedy Horror Thriller             When a group of rich 20somethings plan a hurricane party at a remote family mansion a party game turns deadly in this fresh and funny look at backstabbing fake friends and one party gone very very wrong
The Princess Bride,/title/tt0093779/,Adventure Comedy Family             A bedridden boys grandfather reads him the story of a farmboyturnedpirate who encounters numerous obstacles enemies and allies in his quest to be reunited with his true love
Valerian and the City of a Thousand Planets,/title/tt2239822/,Action Adventure Fantasy             A dark force threatens Alpha a vast metropolis and home to species from a thousand planets Special operatives Valerian and Laureline must race to identify the marauding menace and safeguard not just Alpha but the future of the universe
Saving Private Ryan,/title/tt0120815/,Drama War             Following the Normandy Landings a group of US soldiers go behind enemy lines to retrieve a paratrooper whose brothers have been killed in action
Django Unchained,/title/tt1853728/,Drama Western             With the help of a German bountyhunter a freed slave sets out to rescue his wife from a brutal plantation owner in Mississippi
Moneyball,/title/tt1210166/,Biography Drama Sport             Oakland As general manager Billy Beanes successful attempt to assemble a baseball team on a lean budget by employing computergenerated analysis to acquire new players
Jurassic World: Dominion,/title/tt8041270/,Action Adventure SciFi             Four years after the destruction of Isla Nublar Biosyn operatives attempt to track down Maisie Lockwood while Dr Ellie Sattler investigates a genetically engineered swarm of giant insects
Deadpool 3,/title/tt6263850/,Action Comedy SciFi             Wolverine joins the merc with a mouth in the third installment of the Deadpool film franchise
The Artifice Girl,/title/tt20859464/,Mystery SciFi Thriller             A team of special agents discovers a revolutionary new computer program to bait and trap online predators After teaming up with the programs troubled developer they soon find that the AI is rapidly advancing beyond its original purpose
Black Adam,/title/tt6443346/,Action Adventure Fantasy             Nearly 5000 years after he was bestowed with the almighty powers of the Egyptian godsand imprisoned just as quicklyBlack Adam is freed from his earthly tomb ready to unleash his unique form of justice on the modern world
Conan the Barbarian,/title/tt0082198/,Action Adventure Fantasy             A young boy Conan becomes a slave after his parents are killed and tribe destroyed by a savage warlord and sorcerer Thulsa Doom When he grows up he becomes a fearless invincible fighter Set free he plots revenge against Thulsa Doom
Ticket to Paradise,/title/tt14109724/,Comedy Romance             A divorced couple teams up and travels to Bali to stop their daughter from making the same mistake they think they made 25 years ago
Braveheart,/title/tt0112573/,Biography Drama History             Scottish warrior William Wallace leads his countrymen in a rebellion to free his homeland from the tyranny of King Edward I of England
Mission: Impossible - Fallout,/title/tt4912910/,Action Adventure Thriller             Ethan Hunt and his IMF team along with some familiar allies race against time after a mission gone wrong
Almost Famous,/title/tt0181875/,Adventure Comedy Drama             A highschool boy in the early 1970s is given the chance to write a story for Rolling Stone magazine about an upandcoming rock band as he accompanies them on their concert tour
"The Chronicles of Narnia: The Lion, the Witch and the Wardrobe",/title/tt0363771/,Adventure Family Fantasy             Four kids travel through a wardrobe to the land of Narnia and learn of their destiny to free it with the guidance of a mystical lion
Pride & Prejudice,/title/tt0414387/,Drama Romance             Sparks fly when spirited Elizabeth Bennet meets single rich and proud Mr Darcy But Mr Darcy reluctantly finds himself falling in love with a woman beneath his class Can each overcome their own pride and prejudice
Doctor Strange in the Multiverse of Madness,/title/tt9419884/,Action Adventure Fantasy             Doctor Strange teams up with a mysterious teenage girl from his dreams who can travel across multiverses to battle multiple threats including otheruniverse versions of himself which threaten to wipe out millions across the multiverse They seek help from Wanda the Scarlet Witch Wong and others
The Woman King,/title/tt8093700/,Action Drama History             A historical epic inspired by true events that took place in The Kingdom of Dahomey one of the most powerful states of Africa in the 18th and 19th centuries
Mortal Kombat,/title/tt0293429/,Action Adventure Fantasy             MMA fighter Cole Young seeks out Earths greatest champions in order to stand against the enemies of Outworld in a high stakes battle for the universe
Fast X: Part 2,/title/tt27550022/,Action Crime Thriller             Plot kept under wraps
The Pale Blue Eye,/title/tt14138650/,Crime Horror Mystery             A worldweary detective is hired to investigate the murder of a West Point cadet Stymied by the cadets code of silence he enlists one of their own to help unravel the case  a young man the world would come to know as Edgar Allan Poe
Eyes Wide Shut,/title/tt0120663/,Drama Mystery Thriller             A Manhattan doctor embarks on a bizarre nightlong odyssey after his wifes admission of unfulfilled longing
Nobody,/title/tt7888964/,Action Crime Drama             A docile family man slowly reveals his true character after his house gets burgled by two petty thieves which coincidentally leads him into a bloody war with a Russian crime boss
Gran Turismo,/title/tt4495098/,Action Adventure Drama             The ultimate wish fulfilment tale of a teenage Gran Turismo player whose gaming skills won a series of Nissan competitions to become an actual professional race car driver Based on a true story
Harry Potter and the Prisoner of Azkaban,/title/tt0304141/,Adventure Family Fantasy             Harry Potter Ron and Hermione return to Hogwarts School of Witchcraft and Wizardry for their third year of study where they delve into the mystery surrounding an escaped prisoner who poses a dangerous threat to the young wizard
Star Wars: Episode I - The Phantom Menace,/title/tt0120915/,Action Adventure Fantasy             Two Jedi escape a hostile blockade to find allies and come across a young boy who may bring balance to the Force but the long dormant Sith resurface to claim their original glory
The Magnificent Seven,/title/tt2404435/,Action Adventure Drama             Seven gunmen from a variety of backgrounds are brought together by a vengeful young widow to protect her town from the private army of a destructive industrialist
12 Angry Men,/title/tt0050083/,Crime Drama             The jury in a New York City murder trial is frustrated by a single member whose skeptical caution forces them to more carefully consider the evidence before jumping to a hasty verdict
Pirates of the Caribbean: The Curse of the Black Pearl,/title/tt0325980/,Action Adventure Fantasy             Blacksmith Will Turner teams up with eccentric pirate Captain Jack Sparrow to save his love the governors daughter from Jacks former pirate allies who are now undead
Eternals,/title/tt9032400/,Action Adventure Fantasy             The saga of the Eternals a race of immortal beings who lived on Earth and shaped its history and civilizations
Murder Mystery 2,/title/tt15255288/,Action Comedy Crime             Fulltime detectives Nick and Audrey are struggling to get their private eye agency off the ground They find themselves at the center of international abduction when their friend Maharaja is kidnapped at his own lavish wedding
Harry Potter and the Chamber of Secrets,/title/tt0295297/,Adventure Family Fantasy             An ancient prophecy seems to be coming true when a mysterious presence begins stalking the corridors of a school of magic and leaving its victims paralyzed
Twilight,/title/tt1099212/,Drama Fantasy Romance             When Bella Swan moves to a small town in the Pacific Northwest she falls in love with Edward Cullen a mysterious classmate who reveals himself to be a 108yearold vampire
Deadpool,/title/tt1431045/,Action Comedy             A wisecracking mercenary gets experimented on and becomes immortal but ugly and sets out to track down the man who ruined his looks
Spider-Man,/title/tt0145487/,Action Adventure SciFi             After being bitten by a geneticallymodified spider a shy teenager gains spiderlike abilities that he uses to fight injustice as a masked superhero and face a vengeful enemy
The Mummy,/title/tt0120616/,Action Adventure Fantasy             At an archaeological dig in the ancient city of Hamunaptra an American serving in the French Foreign Legion accidentally awakens a mummy who begins to wreak havoc as he searches for the reincarnation of his longlost love
The Black Phone,/title/tt7144666/,Horror Thriller             After being abducted by a child killer and locked in a soundproof basement a 13yearold boy starts receiving calls on a disconnected phone from the killers previous victims
Blade Runner,/title/tt0083658/,Action Drama SciFi             A blade runner must pursue and terminate four replicants who stole a ship in space and have returned to Earth to find their creator
Sanctuary,/title/tt15364972/,Drama Thriller             Follows a dominatrix and Hal her wealthy client and the disaster that ensues when Hal tries to end their relationship
Indiana Jones and the Kingdom of the Crystal Skull,/title/tt0367882/,Action Adventure             In 1957 Indiana Jones becomes entangled in a Soviet plot to uncover the secret behind mysterious artifacts known as the Crystal Skulls
Ant-Man and the Wasp,/title/tt5095030/,Action Adventure Comedy             As Scott Lang balances being both a superhero and a father Hope van Dyne and Dr Hank Pym present an urgent new mission that finds the AntMan fighting alongside The Wasp to uncover secrets from their past
Sex Drive,/title/tt1135985/,Comedy Romance             A highschool senior drives crosscountry with his best friends to hook up with a babe he met online
10 Things I Hate About You,/title/tt0147800/,Comedy Drama Romance             A highschool boy Cameron cannot date Bianca until her antisocial older sister Kat has a boyfriend So Cameron pays a mysterious boy Patrick to charm Kat
Mean Girls,/title/tt0377092/,Comedy             Cady Heron is a hit with The Plastics the Alist girl clique at her new school until she makes the mistake of falling for Aaron Samuels the exboyfriend of alpha Plastic Regina George
Don't Look Up,/title/tt11286314/,Comedy Drama SciFi             Two lowlevel astronomers must go on a giant media tour to warn humankind of an approaching comet that will destroy planet Earth
Dazed and Confused,/title/tt0106677/,Comedy             The adventures of high school and junior high students on the last day of school in May 1976
Super Mario Bros.,/title/tt0108255/,Adventure Comedy Family             Two Brooklyn plumbers Mario and Luigi must travel to another dimension to rescue a princess from the evil dictator King Koopa and stop him from taking over the world
Run,/title/tt8633478/,Mystery Thriller             A homeschooled teenager begins to suspect her mother is keeping a dark secret from her
The Breakfast Club,/title/tt0088847/,Comedy Drama             Five high school students meet in Saturday detention and discover how they have a great deal more in common than they thought
Apocalypse Now,/title/tt0078788/,Drama Mystery War             A US Army officer serving in Vietnam is tasked with assassinating a renegade Special Forces Colonel who sees himself as a god
Ballerina,/title/tt7181546/,Action Thriller             A young female assassin seeks revenge against the people who killed her family
Aquaman and the Lost Kingdom,/title/tt9663764/,Action Adventure Fantasy             Plot unknown Sequel to the 2018 film Aquaman
One Flew Over the Cuckoo's Nest,/title/tt0073486/,Drama             In the Fall of 1963 a Korean War veteran and criminal pleads insanity and is admitted to a mental institution where he rallies up the scared patients against the tyrannical nurse
Gone Girl,/title/tt2267998/,Drama Mystery Thriller             With his wifes disappearance having become the focus of an intense media circus a man sees the spotlight turned on him when its suspected that he may not be innocent
The Help,/title/tt1454029/,Drama             An aspiring author during the civil rights movement of the 1960s decides to write a book detailing the African American maids point of view on the white families for which they work and the hardships they go through on a daily basis
True Lies,/title/tt0111503/,Action Comedy Thriller             A fearless globetrotting terroristbattling secret agent has his life turned upside down when he discovers his wife might be having an affair with a usedcar salesman while terrorists smuggle nuclear war heads into the United States
The Lorax,/title/tt1482459/,Animation Adventure Comedy             A 12yearold boy searches for the one thing that will enable him to win the affection of the girl of his dreams To find it he must discover the story of the Lorax the grumpy yet charming creature who fights to protect his world
Scarface,/title/tt0086250/,Crime Drama             In 1980 Miami a determined Cuban immigrant takes over a drug cartel and succumbs to greed
Stand by Me,/title/tt0092005/,Adventure Drama             After the death of one of his friends a writer recounts a childhood journey with his friends to find the body of a missing boy
Kindergarten Cop,/title/tt0099938/,Action Comedy Crime             A tough cop must pose as a kindergarten teacher in order to locate a dangerous criminals exwife who may hold the key to putting him behind bars
A Thousand and One,/title/tt12427158/,Crime Drama             After unapologetic and fiercely loyal Inez kidnaps her son Terry from the foster care system mother and son set out to reclaim their sense of home identity and stability in a rapidly changing New York City
Men in Black,/title/tt0119654/,Action Adventure Comedy             A police officer joins a secret organization that polices and monitors extraterrestrial interactions on Earth
Memento,/title/tt0209144/,Mystery Thriller             A man with shortterm memory loss attempts to track down his wifes murderer
Moana,/title/tt3521164/,Animation Adventure Comedy             In Ancient Polynesia when a terrible curse incurred by the Demigod Maui reaches Moanas island she answers the Oceans call to seek out the Demigod to set things right
Mars Attacks!,/title/tt0116996/,Comedy SciFi             Earth is invaded by Martians with unbeatable weapons and a cruel sense of humor
Indiana Jones and the Last Crusade,/title/tt0097576/,Action Adventure             In 1938 after his father goes missing while pursuing the Holy Grail Indiana Jones finds himself up against the Nazis again to stop them from obtaining its powers
Extraction,/title/tt8936646/,Action Thriller             Tyler Rake a fearless black market mercenary embarks on the most deadly extraction of his career when hes enlisted to rescue the kidnapped son of an imprisoned international crime lord
Independence Day,/title/tt0116629/,Action Adventure SciFi             The aliens are coming and their goal is to invade and destroy Earth Fighting superior technology mankinds best weapon is the will to survive
Cars,/title/tt0317219/,Animation Adventure Comedy             On the way to the biggest race of his life a hotshot rookie race car gets stranded in a rundown town and learns that winning isnt everything in life
Grease,/title/tt0077631/,Comedy Musical Romance             Good girl Sandy Olsson and greaser Danny Zuko fell in love over the summer When they unexpectedly discover theyre now in the same high school will they be able to rekindle their romance
Peter Pan,/title/tt0316396/,Adventure Family Fantasy             The Darling family children receive a visit from Peter Pan who takes them to Never Never Land where an ongoing war with the evil Pirate Captain Hook is taking place
Indiana Jones and the Temple of Doom,/title/tt0087469/,Action Adventure             In 1935 Indiana Jones is tasked by Indian villagers with reclaiming a rock stolen from them by a secret cult beneath the catacombs of an ancient palace
Sing 2,/title/tt6467266/,Animation Adventure Comedy             Buster Moon and his friends must persuade reclusive rock star Clay Calloway to join them for the opening of a new show
Drive,/title/tt0780504/,Action Drama             A mysterious Hollywood action film stuntman gets in trouble with gangsters when he tries to help his neighbors husband rob a pawn shop while serving as his getaway driver
The Accountant,/title/tt2140479/,Action Thriller             As a math savant uncooks the books for a new client the Treasury Department closes in on his activities and the body count starts to rise
Black Hawk Down,/title/tt0265086/,Action Drama History             The story of 160 elite US soldiers who dropped into Mogadishu in October 1993 to capture two top lieutenants of a renegade warlord but found themselves in a desperate battle with a large force of heavily armed Somalis
The Hangover,/title/tt1119646/,Comedy             Three buddies wake up from a bachelor party in Las Vegas with no memory of the previous night and the bachelor missing They make their way around the city in order to find their friend before his wedding
Hacksaw Ridge,/title/tt2119532/,Biography Drama History             World War II American Army Medic Desmond T Doss who served during the Battle of Okinawa refuses to kill people and becomes the first man in American history to receive the Medal of Honor without firing a shot
Once Upon a Time in America,/title/tt0087843/,Crime Drama             A former Prohibitionera Jewish gangster returns to the Lower East Side of Manhattan 35 years later where he must once again confront the ghosts and regrets of his old life
Annihilation,/title/tt2798920/,Adventure Drama Horror             A biologist signs up for a dangerous secret expedition into a mysterious zone where the laws of nature dont apply
Mission: Impossible,/title/tt0117060/,Action Adventure Thriller             An American agent under false suspicion of disloyalty must discover and expose the real spy without the help of his organization
Free Guy,/title/tt6264654/,Action Adventure Comedy             A bank teller discovers that hes actually an NPC inside a brutal open world video game
Joker: Folie à Deux,/title/tt11315808/,Crime Drama Musical             Plot unknown Sequel to the 2019 film Joker
